{"allowed_spdx_expressions":["Apache-2.0"],"authorized_signers":[{"fingerprint":"sha256:65b60673d6ed884bf01c2c222d82ada0740f29ac3355d6a925c81f17f47a27b8","public_key":"ebVWLo/mVPlAeLES6KmLp5AfhTrmlb7X4OORC60ElmQ="}],"exceptions":[],"issued_at":"2026-07-25T00:00:00Z","max_evidence_age_seconds":86400,"policy_digest":"sha256:26d5d68cf59df9e751889fa093a5427e13da2a1781e8412ab9a7bc7e63eba6b0","policy_version":"1.0.0","prohibited_spdx_identifiers":["GPL-3.0-only"],"required_evidence":["spdx-3.0-json","in-toto-statement-v1/slsa-v1.1","dsse-v1"],"schema_version":"factory-trust-policy/v1","spdx_license_list_version":"3.25"}
